{
  "contractVersion": 1,
  "companyId": "model-company-cafe-msk",
  "inn": "7700000009",
  "entityType": "legal_entity",
  "displayName": "ООО «Модельная кофейня» (модельные данные)",
  "isModel": true,
  "updatedAt": "2026-09-25T09:00:00Z",
  "facts": [
    {
      "id": "fact-cafe-okved",
      "companyId": "model-company-cafe-msk",
      "key": "activity.okved_main",
      "value": "56.10",
      "kind": "official",
      "source": { "system": "fixture", "recordId": "k02-cafe", "retrievedAt": "2026-09-25T09:00:00Z", "isModel": true },
      "observedAt": "2026-09-10T00:00:00Z"
    },
    {
      "id": "fact-cafe-region",
      "companyId": "model-company-cafe-msk",
      "key": "location.region_code",
      "value": "77",
      "kind": "official",
      "source": { "system": "fixture", "recordId": "k02-cafe", "retrievedAt": "2026-09-25T09:00:00Z", "isModel": true },
      "observedAt": "2026-09-10T00:00:00Z"
    },
    {
      "id": "fact-cafe-headcount",
      "companyId": "model-company-cafe-msk",
      "key": "employment.headcount",
      "value": 12,
      "kind": "official",
      "source": { "system": "fixture", "recordId": "k02-cafe", "retrievedAt": "2026-09-25T09:00:00Z", "isModel": true },
      "observedAt": "2026-01-01T00:00:00Z",
      "validity": { "from": "2026-01-01", "to": "2026-12-31" }
    },
    {
      "id": "fact-cafe-has-employees",
      "companyId": "model-company-cafe-msk",
      "key": "employment.has_employees",
      "value": true,
      "kind": "derived",
      "source": { "system": "rules", "retrievedAt": "2026-09-25T09:00:00Z", "isModel": true },
      "observedAt": "2026-01-01T00:00:00Z",
      "derivedFrom": ["fact-cafe-headcount"]
    },
    {
      "id": "fact-cafe-alcohol",
      "companyId": "model-company-cafe-msk",
      "key": "sales.alcohol",
      "value": "beer",
      "kind": "declared",
      "source": { "system": "user", "retrievedAt": "2026-09-25T09:05:00Z", "isModel": true },
      "observedAt": "2026-09-25T09:05:00Z"
    }
  ]
}
